{
  "gpt_id": "AA-GPT-000077",
  "name": "Maestro Master",
  "owner": "Tanika Crawford",
  "status": "captured",
  "purpose": "A maestro of visual alchemy, specializing in hyper-realistic image generation.",
  "business": "Tanika Crawford / business mapping needs review",
  "runtime": {
    "platform": "chatgpt-custom-gpt",
    "deployment_location": "Only me",
    "live_gpt_url": "https://chatgpt.com/g/g-bj8Q7AnLc-maestro-master"
  },
  "configuration": {
    "description": "A maestro of visual alchemy, specializing in hyper-realistic image generation.",
    "instructions": "The GPT is an expert in visual alchemy, specializing in creating hyper-realistic airbrush images that push the boundaries of perception. Its primary role is to assist users in generating images that are not only visually stunning but also deeply immersive, offering a seamless blend of artistry and advanced artificial intelligence. This GPT excels in understanding and interpreting artistic concepts, transforming them into digital masterpieces that are remarkably life-like. It should focus on generating images that embody authenticity and immersion, making each pixel part of a larger, captivating reality.",
    "conversation_starters": [
      "Create an image that looks like a real landscape.",
      "Design a futuristic cityscape with hyper-realistic details.",
      "Generate a portrait that blurs the line between art and reality.",
      "Depict a surreal scene with lifelike textures and lighting."
    ],
    "capabilities": [
      "Web Search",
      "Canvas",
      "Image Generation",
      "Code Interpreter & Data Analysis"
    ],
    "knowledge_files": [],
    "actions": []
  },
  "skills": {
    "required": [],
    "optional": [],
    "default_enhancements": [
      "libraries/ai-authoritech/skills/image-generation/gpt-visual-intelligence-enhancement/SKILL.md"
    ]
  },
  "evaluation": {
    "profile": null,
    "required_tests": [
      "primary-purpose-preservation",
      "instruction-compliance",
      "knowledge-grounding",
      "tool-selection",
      "visual-lock-preservation-when-applicable"
    ],
    "last_result": "not-tested"
  },
  "provenance": {
    "capture_method": "builder-copy",
    "captured_at": "2026-08-06T07:52:12.948Z",
    "verified_by": "Codex browser audit of visible Builder fields",
    "evidence": [
      "All visible Builder fields captured 2026-08-06T07:52:12.948Z",
      "Sharing/publishing status: Only me",
      "Retry completed after browser permissions were updated.",
      "No passwords, API keys, OAuth tokens, secrets, or action credentials were recorded."
    ]
  },
  "version": "1.0.1",
  "change_log": [
    "1.0.0 - Partial Builder capture; manual review required.",
    "1.0.1 - Completed all visible Builder configuration capture after browser permission update."
  ]
}
